{
  "object_id": "OP01",
  "object_type": "ComparisonBaseline",
  "schema_version": "0.6.0",
  "project_id": "PREPLAN-DEMO-001",
  "chapter_id": "05",
  "work_item_id": "05-01",
  "status": "provisional",
  "revision": 1,
  "created_at": "2026-08-27T12:00:00+00:00",
  "updated_at": "2026-08-27T12:00:00+00:00",
  "created_by": {
    "actor_id": "AGENT-1",
    "name": "Preplan Agent",
    "role": "agent",
    "organization": null,
    "authority_scope": [
      "propose"
    ],
    "contact_ref": null
  },
  "source_snapshot": {
    "PS02": 1,
    "BL01": 1,
    "BL02": 1,
    "BL03": 1,
    "BL04": 1,
    "BL05": 1,
    "BL06": 1,
    "BL07": 1,
    "BL08": 1,
    "OB06": 1
  },
  "data": {
    "data_versions": {},
    "common_assumptions": [
      {
        "id": "id_sample",
        "name": "name_sample"
      }
    ],
    "price_base_date": "2026-08-27",
    "evaluation_model_version": "evaluation_model_version_sample",
    "fixed_conditions": [
      {
        "id": "id_sample",
        "name": "name_sample"
      }
    ],
    "variable_list": [
      {
        "id": "id_sample",
        "name": "name_sample"
      }
    ],
    "units": [
      {
        "id": "id_sample",
        "name": "name_sample"
      }
    ],
    "snapshot_id": "snapshot_id_sample"
  },
  "quality": {
    "completeness": 0.8,
    "consistency": 0.8,
    "timeliness": 0.8,
    "traceability": 0.8,
    "reproducibility": 0.7,
    "issues": [],
    "grade": "B"
  },
  "approval": {
    "status": "pending",
    "required_role": "chapter_reviewer",
    "approver": null,
    "approved_at": null,
    "conditions": [],
    "comment": ""
  }
}